{
  "apiVersion": "aide.dev/v1alpha1",
  "extensions": {},
  "kind": "OwnershipLedger",
  "metadata": {
    "created_at_classification": "fixture-timestamp:ownership-ledger-v1",
    "created_from": "accepted_project_lock_v0",
    "extensions": {},
    "ledger_ref": "aide://ownership-ledger/fixture",
    "ledger_revision": "0",
    "manifest_payload_digest": "sha256:181e6dddf289c87e8c236c536884c1253dbc02d9c4f2588e857889b957aac708",
    "ownership_profile": "fixture-default",
    "project_identity": "fixture/project",
    "project_lock_digest": "sha256:12a52afb3f687e3e588bff48b77897ae9a50ae2737af139d84baefdf25203be9",
    "project_lock_ref": "aide://project-lock/fixture-minimal",
    "project_ref": "aide://project/fixture",
    "selected_distribution_digest": "sha256:d58c533fd233e57c1a1cf6ef482a76a5a0d1158106a4f3ae8c5376b8418f0b63"
  },
  "schema_version": "aide.ownership-ledger.v1",
  "spec": {
    "explicit_non_capabilities": [
      "install_truth",
      "install_plan",
      "install_apply",
      "update_apply",
      "repair_apply",
      "rollback_apply",
      "uninstall_apply",
      "admission",
      "authorization",
      "target_repository_mutation",
      "release_publication",
      "git_tag_creation",
      "github_release_creation",
      "upload",
      "network_call",
      "provider_model_call",
      "workbench_runtime",
      "mcp_runtime",
      "source_change_preview_apply_rollback",
      "promotion"
    ],
    "extensions": {},
    "managed_section_policy": {
      "extensions": {},
      "manual_outside_only": true,
      "requires_exact_section_identity": true
    },
    "optional_features": [
      "managed_section_identity_v1",
      "target_overlay_ownership_v1"
    ],
    "records": [
      {
        "apply_allowed": false,
        "authority": "target_project",
        "content_digest": null,
        "delete_allowed": false,
        "evidence_refs": [],
        "extensions": {},
        "managed_section_identity": null,
        "mutation_policy": "no_apply_metadata_only",
        "overwrite_allowed": false,
        "ownership_class": "never_touch",
        "path_kind": "glob",
        "record_id": "never-touch-git",
        "section_id": null,
        "source_ref": null,
        "target_path": ".git/**"
      },
      {
        "apply_allowed": false,
        "authority": "target_project",
        "content_digest": null,
        "delete_allowed": false,
        "evidence_refs": [],
        "extensions": {},
        "managed_section_identity": null,
        "mutation_policy": "no_apply_metadata_only",
        "overwrite_allowed": false,
        "ownership_class": "unknown",
        "path_kind": "glob",
        "record_id": "unknown-unclassified",
        "section_id": null,
        "source_ref": null,
        "target_path": "unclassified/**"
      },
      {
        "apply_allowed": false,
        "authority": "target_project",
        "content_digest": null,
        "delete_allowed": false,
        "evidence_refs": [],
        "extensions": {},
        "managed_section_identity": null,
        "mutation_policy": "no_apply_metadata_only",
        "overwrite_allowed": false,
        "ownership_class": "preserved_legacy",
        "path_kind": "glob",
        "record_id": "preserved-legacy-state",
        "section_id": null,
        "source_ref": null,
        "target_path": ".aide/legacy/**"
      },
      {
        "apply_allowed": false,
        "authority": "target_project",
        "content_digest": null,
        "delete_allowed": false,
        "evidence_refs": [],
        "extensions": {},
        "managed_section_identity": null,
        "mutation_policy": "no_apply_metadata_only",
        "overwrite_allowed": false,
        "ownership_class": "evidence_only",
        "path_kind": "glob",
        "record_id": "evidence-only-queue-evidence",
        "section_id": null,
        "source_ref": null,
        "target_path": ".aide/queue/**/evidence/**"
      },
      {
        "apply_allowed": false,
        "authority": "target_project",
        "content_digest": null,
        "delete_allowed": false,
        "evidence_refs": [],
        "extensions": {},
        "managed_section_identity": null,
        "mutation_policy": "no_apply_metadata_only",
        "overwrite_allowed": false,
        "ownership_class": "local_only",
        "path_kind": "glob",
        "record_id": "local-only-operator-state",
        "section_id": null,
        "source_ref": null,
        "target_path": "local-only/**"
      },
      {
        "apply_allowed": false,
        "authority": "target_project",
        "content_digest": null,
        "delete_allowed": false,
        "evidence_refs": [],
        "extensions": {},
        "managed_section_identity": null,
        "mutation_policy": "no_apply_metadata_only",
        "overwrite_allowed": false,
        "ownership_class": "runtime_generated",
        "path_kind": "glob",
        "record_id": "runtime-generated-local-state",
        "section_id": null,
        "source_ref": null,
        "target_path": ".aide.local/**"
      },
      {
        "apply_allowed": false,
        "authority": "target_project",
        "content_digest": null,
        "delete_allowed": false,
        "evidence_refs": [],
        "extensions": {},
        "managed_section_identity": null,
        "mutation_policy": "no_apply_metadata_only",
        "overwrite_allowed": false,
        "ownership_class": "project_generated",
        "path_kind": "file",
        "record_id": "project-generated-context",
        "section_id": null,
        "source_ref": null,
        "target_path": ".aide/context/generated/context-pack.json"
      },
      {
        "apply_allowed": false,
        "authority": "target_project",
        "content_digest": null,
        "delete_allowed": false,
        "evidence_refs": [],
        "extensions": {},
        "managed_section_identity": null,
        "mutation_policy": "no_apply_metadata_only",
        "overwrite_allowed": false,
        "ownership_class": "project_overlay",
        "path_kind": "file",
        "record_id": "project-overlay-policy",
        "section_id": null,
        "source_ref": null,
        "target_path": ".aide/project-overlays/policy.yaml"
      },
      {
        "apply_allowed": false,
        "authority": "target_project",
        "content_digest": null,
        "delete_allowed": false,
        "evidence_refs": [],
        "extensions": {},
        "managed_section_identity": null,
        "mutation_policy": "no_apply_metadata_only",
        "overwrite_allowed": false,
        "ownership_class": "project_owned",
        "path_kind": "file",
        "record_id": "project-owned-readme",
        "section_id": null,
        "source_ref": null,
        "target_path": "README.md"
      },
      {
        "apply_allowed": false,
        "authority": "aide_distribution",
        "content_digest": "sha256:7e2c27b25ac5ca86f8ec2948c9982d831ea03f8a3d91ed854d298b80683d5a08",
        "delete_allowed": false,
        "evidence_refs": [],
        "extensions": {},
        "managed_section_identity": "AIDE-GENERATED:aide-self-hosting-summary",
        "mutation_policy": "no_apply_metadata_only",
        "overwrite_allowed": false,
        "ownership_class": "vendor_managed_section",
        "path_kind": "managed_section",
        "record_id": "vendor-section-agents-summary",
        "section_id": "aide-self-hosting-summary",
        "source_ref": "aide://distribution/fixture-minimal",
        "target_path": "AGENTS.md"
      },
      {
        "apply_allowed": false,
        "authority": "aide_distribution",
        "content_digest": "sha256:7e2c27b25ac5ca86f8ec2948c9982d831ea03f8a3d91ed854d298b80683d5a08",
        "delete_allowed": false,
        "evidence_refs": [],
        "extensions": {},
        "managed_section_identity": null,
        "mutation_policy": "no_apply_metadata_only",
        "overwrite_allowed": false,
        "ownership_class": "vendor_managed_file",
        "path_kind": "file",
        "record_id": "vendor-file-project-lock-schema",
        "section_id": null,
        "source_ref": "aide://distribution/fixture-minimal",
        "target_path": ".aide/protocol/aide-project-lock-v0.schema.json"
      },
      {
        "apply_allowed": false,
        "authority": "aide_distribution",
        "content_digest": "sha256:7e2c27b25ac5ca86f8ec2948c9982d831ea03f8a3d91ed854d298b80683d5a08",
        "delete_allowed": false,
        "evidence_refs": [],
        "extensions": {},
        "managed_section_identity": null,
        "mutation_policy": "no_apply_metadata_only",
        "overwrite_allowed": false,
        "ownership_class": "vendor_managed_file",
        "path_kind": "file",
        "record_id": "vendor-file-aide-lite-cli",
        "section_id": null,
        "source_ref": "aide://distribution/fixture-minimal",
        "target_path": ".aide/scripts/aide_lite.py"
      }
    ],
    "required_features": [
      "distribution_manifest_v1",
      "ownership_ledger_v1",
      "project_lock_v0",
      "sha256_digest_canonical_json_v1"
    ],
    "taxonomy": [
      {
        "authority": "aide_distribution",
        "automatic_apply_allowed": false,
        "blocks_automatic_apply": false,
        "class_id": "vendor_managed_file",
        "delete_allowed": false,
        "description": "AIDE-distributed file with exact source digest authority.",
        "extensions": {},
        "overwrite_allowed": false
      },
      {
        "authority": "aide_distribution",
        "automatic_apply_allowed": false,
        "blocks_automatic_apply": false,
        "class_id": "vendor_managed_section",
        "delete_allowed": false,
        "description": "AIDE-distributed managed section inside a host file.",
        "extensions": {},
        "overwrite_allowed": false
      },
      {
        "authority": "target_project",
        "automatic_apply_allowed": false,
        "blocks_automatic_apply": true,